!DOCTYPE note
<!ELEMENT note (DATA)>
<!ELEMENT DATA (ARTIST,COUNTRY,YEAR)>
<!ELEMENT ARTIST (#PCDATA)>
<!ELEMENT COUNTRY (#PCDATA)>
<!ELEMENT YEAR (#PCDATA)>